<?xml version="1.0" encoding="UTF-8"?>
<TestProject xmlns="http://www.fittest.eu/TestProject" xmlns:xsi="http://www.w3.org/2001/XMLSchema-instance" xsi:schemaLocation="http://www.fittest.eu/TestProject TestProject.xsd ">
  <General>
    <type>FLASH</type>
    <baseURL>http://host:port</baseURL>
    <entryPage>index.html</entryPage>
    <serverFolder>serverFolder</serverFolder>
  </General>
  <Logging>
    <Instrumentation>
      <ghcrtOption>ghcrtOption</ghcrtOption>
    </Instrumentation>
    <LogTarget>
      <storeDir>Testing sessions</storeDir>
      <logLevel>3</logLevel>
    </LogTarget>
  </Logging>
  <ModelInference>
    <domainInputSpecFile>Models/xinput.xml</domainInputSpecFile>
    <absFuncDefFile>Models/absFunc.xml</absFuncDefFile>
    <modelFile>Models/model.fsm</modelFile>
    <inferenceTechnique>SEQUENCE-BASED</inferenceTechnique>
    <generateDot>true</generateDot>
    <gaParam>
      <maxNumberOfGenerations>100</maxNumberOfGenerations>
      <mutationRate>0.1</mutationRate>
      <timeBudget>0</timeBudget>
    </gaParam>
  </ModelInference>
  <TestGeneration>
    <cteFolder>Models/ctes</cteFolder>
    <modelVisitStrategy>VISITOR_BREADTHFIRST</modelVisitStrategy>
    <reduceTestSuite>true</reduceTestSuite>
    <sourcePackagePrefix>eu.fittest.test</sourcePackagePrefix>
    <seleniumDriverBrowser>HtmlUnitDriver</seleniumDriverBrowser>
    <seleniumRemoteHost>localhost</seleniumRemoteHost>
    <seleniumRemotePort>4444</seleniumRemotePort>
    <seleniumBrowserConfig>*googlechrome</seleniumBrowserConfig>
  </TestGeneration>
  <Oracle/>
</TestProject>
